[
  {
    "_id": "vul-131001001",
    "version": "vul",
    "chapter": "obadiah-1",
    "sequence": "131001001",
    "number": 1,
    "text": "visio Abdiae haec dicit Dominus Deus ad Edom auditum audivimus a Domino et legatum ad gentes misit surgite et consurgamus adversum eum in proelium",
    "paragraphs": [0]
  },
  {
    "_id": "vul-131001002",
    "version": "vul",
    "chapter": "obadiah-1",
    "sequence": "131001002",
    "number": 2,
    "text": "ecce parvulum te dedi in gentibus contemptibilis tu es valde"
  },
  {
    "_id": "vul-131001003",
    "version": "vul",
    "chapter": "obadiah-1",
    "sequence": "131001003",
    "number": 3,
    "text": "superbia cordis tui extulit te habitantem in scissuris petrae exaltantem solium suum qui dicit in corde suo quis detrahet me in terram"
  },
  {
    "_id": "vul-131001004",
    "version": "vul",
    "chapter": "obadiah-1",
    "sequence": "131001004",
    "number": 4,
    "text": "si exaltatus fueris ut aquila et si inter sidera posueris nidum tuum inde detraham te dicit Dominus"
  },
  {
    "_id": "vul-131001005",
    "version": "vul",
    "chapter": "obadiah-1",
    "sequence": "131001005",
    "number": 5,
    "text": "si fures introissent ad te si latrones per noctem quomodo conticuisses nonne furati essent sufficientia sibi si vindemiatores introissent ad te numquid saltim racemos reliquissent tibi"
  },
  {
    "_id": "vul-131001006",
    "version": "vul",
    "chapter": "obadiah-1",
    "sequence": "131001006",
    "number": 6,
    "text": "quomodo scrutati sunt Esau investigaverunt abscondita eius"
  },
  {
    "_id": "vul-131001007",
    "version": "vul",
    "chapter": "obadiah-1",
    "sequence": "131001007",
    "number": 7,
    "text": "usque ad terminum emiserunt te omnes viri foederis tui inluserunt tibi invaluerunt adversum te viri pacis tuae qui comedunt tecum ponent insidias subter te non est prudentia in eo"
  },
  {
    "_id": "vul-131001008",
    "version": "vul",
    "chapter": "obadiah-1",
    "sequence": "131001008",
    "number": 8,
    "text": "numquid non in die illa dicit Dominus perdam sapientes de Idumea et prudentiam de monte Esau"
  },
  {
    "_id": "vul-131001009",
    "version": "vul",
    "chapter": "obadiah-1",
    "sequence": "131001009",
    "number": 9,
    "text": "et timebunt fortes tui a meridie ut intereat vir de monte Esau"
  },
  {
    "_id": "vul-131001010",
    "version": "vul",
    "chapter": "obadiah-1",
    "sequence": "131001010",
    "number": 10,
    "text": "propter interfectionem et propter iniquitatem in fratrem tuum Iacob operiet te confusio et peribis in aeternum"
  },
  {
    "_id": "vul-131001011",
    "version": "vul",
    "chapter": "obadiah-1",
    "sequence": "131001011",
    "number": 11,
    "text": "in die cum stares adversus quando capiebant alieni exercitum eius et extranei ingrediebantur portas eius et super Hierusalem mittebant sortem tu quoque eras quasi unus ex eis"
  },
  {
    "_id": "vul-131001012",
    "version": "vul",
    "chapter": "obadiah-1",
    "sequence": "131001012",
    "number": 12,
    "text": "et non despicies in die fratris tui in die peregrinationis eius et non laetaberis super filios Iuda in die perditionis eorum et non magnificabis os tuum in die angustiae"
  },
  {
    "_id": "vul-131001013",
    "version": "vul",
    "chapter": "obadiah-1",
    "sequence": "131001013",
    "number": 13,
    "text": "neque ingredieris portam populi mei in die ruinae eorum neque despicies et tu in malis eius in die vastitatis illius et non emitteris adversum exercitum eius in die vastitatis illius"
  },
  {
    "_id": "vul-131001014",
    "version": "vul",
    "chapter": "obadiah-1",
    "sequence": "131001014",
    "number": 14,
    "text": "neque stabis in exitibus ut interficias eos qui fugerint et non concludes reliquos eius in die tribulationis"
  },
  {
    "_id": "vul-131001015",
    "version": "vul",
    "chapter": "obadiah-1",
    "sequence": "131001015",
    "number": 15,
    "text": "quoniam iuxta est dies Domini super omnes gentes sicut fecisti fiet tibi retributionem tuam convertet in caput tuum"
  },
  {
    "_id": "vul-131001016",
    "version": "vul",
    "chapter": "obadiah-1",
    "sequence": "131001016",
    "number": 16,
    "text": "quomodo enim bibisti super montem sanctum meum bibent omnes gentes iugiter et bibent et absorbent et erunt quasi non sint"
  },
  {
    "_id": "vul-131001017",
    "version": "vul",
    "chapter": "obadiah-1",
    "sequence": "131001017",
    "number": 17,
    "text": "et in monte Sion erit salvatio et erit sanctus et possidebit domus Iacob eos qui se possederant"
  },
  {
    "_id": "vul-131001018",
    "version": "vul",
    "chapter": "obadiah-1",
    "sequence": "131001018",
    "number": 18,
    "text": "et erit domus Iacob ignis et domus Ioseph flamma et domus Esau stipula et succendentur in eis et devorabunt eos et non erunt reliquiae domus Esau quia Dominus locutus est"
  },
  {
    "_id": "vul-131001019",
    "version": "vul",
    "chapter": "obadiah-1",
    "sequence": "131001019",
    "number": 19,
    "text": "et hereditabunt hii qui ad austrum montem Esau et qui in campestribus Philisthim et possidebunt regionem Ephraim et regionem Samariae et Beniamin possidebit Galaad"
  },
  {
    "_id": "vul-131001020",
    "version": "vul",
    "chapter": "obadiah-1",
    "sequence": "131001020",
    "number": 20,
    "text": "et transmigratio exercitus huius filiorum Israhel omnia Chananeorum usque ad Saraptham et transmigratio Hierusalem quae in Bosforo est possidebit civitates austri"
  },
  {
    "_id": "vul-131001021",
    "version": "vul",
    "chapter": "obadiah-1",
    "sequence": "131001021",
    "number": 21,
    "text": "et ascendent salvatores in montem Sion iudicare montem Esau et erit Domino regnum"
  }
]
