[
  {
    "_id": "ylt-225001001",
    "version": "ylt",
    "chapter": "3-john-1",
    "sequence": "225001001",
    "number": 1,
    "text": "The Elder to Gaius the beloved, whom I love in truth!",
    "paragraphs": [0]
  },
  {
    "_id": "ylt-225001002",
    "version": "ylt",
    "chapter": "3-john-1",
    "sequence": "225001002",
    "number": 2,
    "text": "beloved, concerning all things I desire thee to prosper, and to be in health, even as thy soul doth prosper,"
  },
  {
    "_id": "ylt-225001003",
    "version": "ylt",
    "chapter": "3-john-1",
    "sequence": "225001003",
    "number": 3,
    "text": "for I rejoiced exceedingly, brethren coming and testifying of the truth in thee, even as thou in truth dost walk;"
  },
  {
    "_id": "ylt-225001004",
    "version": "ylt",
    "chapter": "3-john-1",
    "sequence": "225001004",
    "number": 4,
    "text": "greater than these things I have no joy, that I may hear of my children in truth walking."
  },
  {
    "_id": "ylt-225001005",
    "version": "ylt",
    "chapter": "3-john-1",
    "sequence": "225001005",
    "number": 5,
    "text": "Beloved, faithfully dost thou do whatever thou mayest work to the brethren and to the strangers,"
  },
  {
    "_id": "ylt-225001006",
    "version": "ylt",
    "chapter": "3-john-1",
    "sequence": "225001006",
    "number": 6,
    "text": "who did testify of thy love before an assembly, whom thou wilt do well, having sent forward worthily of God,"
  },
  {
    "_id": "ylt-225001007",
    "version": "ylt",
    "chapter": "3-john-1",
    "sequence": "225001007",
    "number": 7,
    "text": "because for His name they went forth, nothing receiving from the nations;"
  },
  {
    "_id": "ylt-225001008",
    "version": "ylt",
    "chapter": "3-john-1",
    "sequence": "225001008",
    "number": 8,
    "text": "we, then, ought to receive such, that fellow-workers we may become to the truth."
  },
  {
    "_id": "ylt-225001009",
    "version": "ylt",
    "chapter": "3-john-1",
    "sequence": "225001009",
    "number": 9,
    "text": "I did write to the assembly, but he who is loving the first place among them-Diotrephes-doth not receive us;"
  },
  {
    "_id": "ylt-225001010",
    "version": "ylt",
    "chapter": "3-john-1",
    "sequence": "225001010",
    "number": 10,
    "text": "because of this, if I may come, I will cause him to remember his works that he doth, with evil words prating against us; and not content with these, neither doth he himself receive the brethren, and those intending he doth forbid, and out of the assembly he doth cast."
  },
  {
    "_id": "ylt-225001011",
    "version": "ylt",
    "chapter": "3-john-1",
    "sequence": "225001011",
    "number": 11,
    "text": "Beloved, be not thou following that which is evil, but that which is good; he who is doing good, of God he is, and he who is doing evil hath not seen God;"
  },
  {
    "_id": "ylt-225001012",
    "version": "ylt",
    "chapter": "3-john-1",
    "sequence": "225001012",
    "number": 12,
    "text": "to Demetrius testimony hath been given by all, and by the truth itself, and we also-we do testify, and ye have known that our testimony is true."
  },
  {
    "_id": "ylt-225001013",
    "version": "ylt",
    "chapter": "3-john-1",
    "sequence": "225001013",
    "number": 13,
    "text": "Many things I had to write, but I do not wish through ink and pen to write to thee,"
  },
  {
    "_id": "ylt-225001014",
    "version": "ylt",
    "chapter": "3-john-1",
    "sequence": "225001014",
    "number": 14,
    "text": "and I hope straightway to see thee, and mouth to mouth we shall speak."
  },
  {
    "_id": "ylt-225001015",
    "version": "ylt",
    "chapter": "3-john-1",
    "sequence": "225001015",
    "number": 15,
    "text": "Peace to thee! salute thee do the friends; be saluting the friends by name."
  }
]
