[
  {
    "_id": "webp-224001001",
    "version": "webp",
    "chapter": "2-john-1",
    "sequence": "224001001",
    "number": 1,
    "text": "The elder, to the chosen lady and her children, whom I love in truth, and not I only, but also all those who know the truth,",
    "paragraphs": [0]
  },
  {
    "_id": "webp-224001002",
    "version": "webp",
    "chapter": "2-john-1",
    "sequence": "224001002",
    "number": 2,
    "text": "for the truth’s sake, which remains in us, and it will be with us forever:"
  },
  {
    "_id": "webp-224001003",
    "version": "webp",
    "chapter": "2-john-1",
    "sequence": "224001003",
    "number": 3,
    "text": "Grace, mercy, and peace will be with us, from God the Father and from the Lord Jesus Christ,° the Son of the Father, in truth and love.",
    "footnotes": [
      {
        "type": "stu",
        "text": "“Christ” means “Anointed One”."
      }
    ]
  },
  {
    "_id": "webp-224001004",
    "version": "webp",
    "chapter": "2-john-1",
    "sequence": "224001004",
    "number": 4,
    "text": "I rejoice greatly that I have found some of your children walking in truth, even as we have been commanded by the Father.",
    "paragraphs": [0]
  },
  {
    "_id": "webp-224001005",
    "version": "webp",
    "chapter": "2-john-1",
    "sequence": "224001005",
    "number": 5,
    "text": "Now I beg you, dear lady, not as though I wrote to you a new commandment, but that which we had from the beginning, that we love one another."
  },
  {
    "_id": "webp-224001006",
    "version": "webp",
    "chapter": "2-john-1",
    "sequence": "224001006",
    "number": 6,
    "text": "This is love, that we should walk according to his commandments. This is the commandment, even as you heard from the beginning, that you should walk in it."
  },
  {
    "_id": "webp-224001007",
    "version": "webp",
    "chapter": "2-john-1",
    "sequence": "224001007",
    "number": 7,
    "text": "For many deceivers have gone out into the world, those who don’t confess that Jesus Christ came in the flesh. This is the deceiver and the Antichrist.",
    "paragraphs": [0]
  },
  {
    "_id": "webp-224001008",
    "version": "webp",
    "chapter": "2-john-1",
    "sequence": "224001008",
    "number": 8,
    "text": "Watch yourselves, that we don’t lose the things which we have accomplished, but that we receive a full reward."
  },
  {
    "_id": "webp-224001009",
    "version": "webp",
    "chapter": "2-john-1",
    "sequence": "224001009",
    "number": 9,
    "text": "Whoever transgresses and doesn’t remain in the teaching of Christ doesn’t have God. He who remains in the teaching has both the Father and the Son."
  },
  {
    "_id": "webp-224001010",
    "version": "webp",
    "chapter": "2-john-1",
    "sequence": "224001010",
    "number": 10,
    "text": "If anyone comes to you and doesn’t bring this teaching, don’t receive him into your house, and don’t welcome him,"
  },
  {
    "_id": "webp-224001011",
    "version": "webp",
    "chapter": "2-john-1",
    "sequence": "224001011",
    "number": 11,
    "text": "for he who welcomes him participates in his evil deeds."
  },
  {
    "_id": "webp-224001012",
    "version": "webp",
    "chapter": "2-john-1",
    "sequence": "224001012",
    "number": 12,
    "text": "Having many things to write to you, I don’t want to do so with paper and ink, but I hope to come to you and to speak face to face, that our joy may be made full.",
    "paragraphs": [0]
  },
  {
    "_id": "webp-224001013",
    "version": "webp",
    "chapter": "2-john-1",
    "sequence": "224001013",
    "number": 13,
    "text": "The children of your chosen sister greet you. Amen."
  }
]
