[
  {
    "_id": "vul-224001001",
    "version": "vul",
    "chapter": "2-john-1",
    "sequence": "224001001",
    "number": 1,
    "text": "senior electae dominae et natis eius quos ego diligo in veritate et non ego solus sed et omnes qui cognoverunt veritatem",
    "paragraphs": [0]
  },
  {
    "_id": "vul-224001002",
    "version": "vul",
    "chapter": "2-john-1",
    "sequence": "224001002",
    "number": 2,
    "text": "propter veritatem quae permanet in nobis et nobiscum erit in aeternum"
  },
  {
    "_id": "vul-224001003",
    "version": "vul",
    "chapter": "2-john-1",
    "sequence": "224001003",
    "number": 3,
    "text": "sit nobiscum gratia misericordia pax a Deo Patre et a Christo Iesu Filio Patris in veritate et caritate"
  },
  {
    "_id": "vul-224001004",
    "version": "vul",
    "chapter": "2-john-1",
    "sequence": "224001004",
    "number": 4,
    "text": "gavisus sum valde quoniam inveni de filiis tuis ambulantes in veritate sicut mandatum accepimus a Patre"
  },
  {
    "_id": "vul-224001005",
    "version": "vul",
    "chapter": "2-john-1",
    "sequence": "224001005",
    "number": 5,
    "text": "et nunc rogo te domina non tamquam mandatum novum scribens tibi sed quod habuimus ab initio ut diligamus alterutrum"
  },
  {
    "_id": "vul-224001006",
    "version": "vul",
    "chapter": "2-john-1",
    "sequence": "224001006",
    "number": 6,
    "text": "et haec est caritas ut ambulemus secundum mandata eius hoc mandatum est ut quemadmodum audistis ab initio in eo ambuletis"
  },
  {
    "_id": "vul-224001007",
    "version": "vul",
    "chapter": "2-john-1",
    "sequence": "224001007",
    "number": 7,
    "text": "quoniam multi seductores exierunt in mundum qui non confitentur Iesum Christum venientem in carne hic est seductor et antichristus"
  },
  {
    "_id": "vul-224001008",
    "version": "vul",
    "chapter": "2-john-1",
    "sequence": "224001008",
    "number": 8,
    "text": "videte vosmet ipsos ne perdatis quae operati estis sed ut mercedem plenam accipiatis"
  },
  {
    "_id": "vul-224001009",
    "version": "vul",
    "chapter": "2-john-1",
    "sequence": "224001009",
    "number": 9,
    "text": "omnis qui praecedit et non manet in doctrina Christi Deum non habet qui permanet in doctrina hic et Filium et Patrem habet"
  },
  {
    "_id": "vul-224001010",
    "version": "vul",
    "chapter": "2-john-1",
    "sequence": "224001010",
    "number": 10,
    "text": "si quis venit ad vos et hanc doctrinam non adfert nolite recipere eum in domum nec have ei dixeritis"
  },
  {
    "_id": "vul-224001011",
    "version": "vul",
    "chapter": "2-john-1",
    "sequence": "224001011",
    "number": 11,
    "text": "qui enim dicit illi have communicat operibus illius malignis"
  },
  {
    "_id": "vul-224001012",
    "version": "vul",
    "chapter": "2-john-1",
    "sequence": "224001012",
    "number": 12,
    "text": "plura habens vobis scribere nolui per cartam et atramentum spero enim me futurum apud vos et os ad os loqui ut gaudium vestrum plenum sit"
  },
  {
    "_id": "vul-224001013",
    "version": "vul",
    "chapter": "2-john-1",
    "sequence": "224001013",
    "number": 13,
    "text": "salutant te filii sororis tuae electae"
  }
]
